{
  "schema_version": "1.0.0",
  "task_id": "task-001",
  "created_at": "2026-08-05T08:02:02.000+08:00",
  "audio": {
    "path_ref": "input/sample.mp3",
    "sha256": "aaaaaaaaaaaaaaaaaaaaaaaaaaaaaaaaaaaaaaaaaaaaaaaaaaaaaaaaaaaaaaaa",
    "duration_ms": 5000,
    "language": "zh-CN",
    "mime_type": "audio/mpeg"
  },
  "full_text": "欢迎使用水星\n字幕工具",
  "segments": [
    {
      "segment_id": "seg-0001",
      "index": 0,
      "start_ms": 0,
      "end_ms": 2500,
      "text": "欢迎使用水星",
      "confidence": 0.96,
      "words": [
        { "word_id": "word-0001", "index": 0, "start_ms": 0, "end_ms": 600, "text": "欢迎", "confidence": 0.98 },
        { "word_id": "word-0002", "index": 1, "start_ms": 600, "end_ms": 1200, "text": "使用", "confidence": 0.97 },
        { "word_id": "word-0003", "index": 2, "start_ms": 1200, "end_ms": 2500, "text": "水星", "confidence": 0.94 }
      ]
    },
    {
      "segment_id": "seg-0002",
      "index": 1,
      "start_ms": 2500,
      "end_ms": 5000,
      "text": "字幕工具",
      "confidence": null,
      "words": []
    }
  ],
  "model_snapshot_ref": "snapshot-001",
  "call": {
    "call_id": "call-asr-0001",
    "model_snapshot_entry_ref": "snapshot-entry-asr",
    "started_at": "2026-08-05T08:02:00.000+08:00",
    "ended_at": "2026-08-05T08:02:01.000+08:00",
    "outcome": "completed",
    "provider_request_id": "request-fixture-asr-0001",
    "error_ref": null
  },
  "raw_response_ref": "work/provider-response.asr.redacted.json",
  "warnings": [],
  "errors": []
}
